id,name,role,experience_years,skills,current_project,summary
1,Alice Smith,Senior Python Developer,10,"Python, Django, AWS, PostgreSQL, REST APIs, Celery","Developing a new microservice for payment processing.","Alice is a 10-year veteran in backend development, specializing in scalable web applications using Django and AWS cloud infrastructure. She has a strong background in database design and performance tuning with PostgreSQL."
2,Bob Johnson,Data Scientist,5,"Python, Pandas, Scikit-learn, R, SQL, Tableau, TensorFlow","Building a customer churn prediction model.","Bob has 5 years of experience in data science, with a focus on machine learning models for market prediction. Proficient in both Python and R, he also excels at creating insightful Tableau dashboards."
3,Carol Williams,Lead Frontend Developer,8,"JavaScript, React, Redux, Node.js, CSS, TypeScript, Webpack","Refactoring the main customer-facing dashboard for better performance.","Carol is a creative frontend lead who builds beautiful and responsive user interfaces using React.js and TypeScript. She is passionate about web performance and mentors junior developers."
4,David Brown,AI Engineer,4,"Python, TensorFlow, PyTorch, LangChain, NLP, Hugging Face, RAG","Implementing a RAG pipeline for internal document search.","David is an AI engineer passionate about building large-scale NLP models. He has 4 years of experience with RAG pipelines, LangChain, and fine-tuning models from Hugging Face."
5,Eva Green,Product Manager,7,"Agile, Scrum, JIRA, User Research, Roadmapping, Stakeholder Communication","Launching a new mobile app feature set for Q4.","Eva is a product manager who excels at bridging the gap between technical teams and user needs. She is certified in Scrum and has a strong background in B2C user research."
6,Frank Miller,DevOps Engineer,6,"AWS, Docker, Kubernetes, Terraform, Jenkins, CI/CD, Bash Scripting","Migrating the production environment to a new Kubernetes cluster.","Frank is a DevOps professional focused on infrastructure as code (IaC) using Terraform. He has extensive experience building and maintaining robust CI/CD pipelines with Jenkins and Docker."
7,Grace Lee,UI/UX Designer,5,"Figma, Sketch, Adobe XD, User Journey Mapping, Wireframing, Prototyping","Designing the user flow for the new e-commerce checkout process.","Grace is a user-centric designer who specializes in creating intuitive and visually appealing interfaces. She is highly skilled in Figma and conducts thorough user journey mapping."
8,Henry White,Database Administrator (DBA),12,"SQL, PostgreSQL, MySQL, MongoDB, Database Optimization, Backup & Recovery","Performing a large-scale database migration from MySQL to PostgreSQL.","Henry is a senior DBA with over a
decade of experience. He ensures database integrity, performance, and reliability. He is an expert in both relational (SQL) and NoSQL (MongoDB) databases."
9,Ivy Chen,QA Automation Engineer,5,"Selenium, Python, Java, Cypress, JUnit, Postman, API Testing","Building an automated regression testing suite for the main API.","Ivy specializes in building automated testing frameworks. She uses Selenium and Cypress for UI testing and Postman for ensuring API reliability. Proficient in both Python and Java for scripting."
10,Jack Black,Junior Backend Developer,1,"Go (Golang), Gin, Docker, SQL","Assisting the backend team with API endpoint development.","Jack is an enthusiastic junior developer with a year of experience in Go. He is a fast learner, comfortable with Docker, and supports the senior developers on the payments microservice."
11,Karen Hill,Cloud Solutions Architect,9,"AWS, Azure, GCP, CloudFormation, Terraform, Solution Design, Cost Management","Designing a multi-cloud strategy for a new enterprise client.","Karen is a certified cloud architect with expertise in AWS, Azure, and GCP. She designs scalable, secure, and cost-effective cloud solutions for enterprise-level applications."
12,Leo Martin,Machine Learning Engineer,3,"Python, PyTorch, Pandas, Scikit-learn, Computer Vision (CV), OpenCV","Training a new computer vision model to detect product defects.","Leo is an ML Engineer focused on computer vision. He has 3 years of experience using PyTorch and OpenCV to build real-time defect detection systems for manufacturing clients."
13,Mia Rodriguez,Senior Data Analyst,6,"SQL, Python, Pandas, Tableau, Power BI, Excel, Statistical Analysis","Analyzing sales data to identify new market opportunities.","Mia is a meticulous data analyst who uncovers business insights from complex datasets. She is an expert in SQL and data visualization tools like Tableau and Power BI."
14,Nathan Price,Full-Stack Developer,5,"JavaScript, React, Node.js, Python, Django, MongoDB, SQL","Developing a new internal admin tool from scratch.","Nathan is a versatile full-stack developer, equally comfortable with a React/Node.js stack and a Python/Django backend. He enjoys building complete features from end to end."
15,Olivia Kim,Scrum Master,8,"Scrum, Agile Coaching, Kanban, JIRA, Conflict Resolution, Facilitation","Coaching two new development teams on Agile best practices.","Olivia is a dedicated Scrum Master who facilitates all Agile ceremonies and removes impediments for her teams. She is an excellent communicator and conflict resolver."
16,Paul Harris,Mobile Developer (iOS),4,"Swift, SwiftUI, UIKit, Xcode, CoreData","Developing the new iOS version of the company's main application.","Paul is an iOS developer with 4 years of experience building native apps using Swift and SwiftUI. He has a keen eye for Apple's design principles and app performance."
17,Quinn Davis,Marketing Specialist,3,"SEO, SEM, Google Analytics, Content Marketing, Social Media","Running a new SEO campaign to increase organic traffic.","Quinn is a digital marketing specialist who focuses on data-driven growth. She is certified in Google Analytics and manages all SEO/SEM and content marketing efforts."
18,Rachel Liu,Technical Writer,5,"Markdown, Confluence, JIRA, API Documentation, User Guides","Writing the complete API documentation for the new payments service.","Rachel creates clear and concise technical documentation for both internal developers and external customers. She is an expert in Confluence and API documentation standards."
19,Sam Wilson,DevOps Engineer,6,"Azure, .NET, Docker, Kubernetes, Azure DevOps, PowerShell","Automating .NET application deployments on Azure Kubernetes Service (AKS).","Sam is an Azure-focused DevOps engineer. He specializes in the Microsoft stack, using Azure DevOps and PowerShell to automate CI/CD pipelines for .NET applications running on AKS."
20,Tina Brown,Data Scientist,7,"Python, PySpark, Databricks, SQL, Scikit-learn, AWS SageMaker","Optimizing a large-scale data processing pipeline on Databricks.","Tina is a senior data scientist specializing in big data. She has 7 years of experience using PySpark and AWS SageMaker to build and deploy ML models on massive datasets."
21,Umar Farooq,Senior AI Engineer,8,"Python, PyTorch, LangChain, RAG, Vector Databases, AWS, Kubernetes","Leading the development of a generative AI platform for enterprise customers.","Umar is a lead AI engineer with deep expertise in Generative AI. He leads a team building RAG systems using LangChain, vector databases, and deploying them on Kubernetes."
22,Vera Patel,UI/UX Lead,9,"Figma, Adobe Creative Suite, Design Systems, Leadership, Mentoring","Overseeing the creation of a new, company-wide design system.","Vera leads the UI/UX team and is responsible for the company's design vision. She is currently sponsoring the development of a unified design system to ensure brand consistency."
23,Will Evans,Frontend Developer,2,"JavaScript, Vue.js, Nuxt.js, CSS, HTML","Building a new marketing website using the Nuxt.js framework.","Will is a frontend developer with 2 years of experience, specializing in the Vue.js ecosystem. He is proficient with Vue, Vuex, and server-side rendering with Nuxt.js."
24,Xena Yang,Security Analyst,4,"NIST Framework, Penetration Testing, SIEM, Wireshark, Python","Conducting a quarterly security audit and penetration test.","Xena is a security analyst focused on identifying and mitigating risks. She has experience with penetration testing, SIEM tools, and is proficient in Python for scripting security tasks."
25,Zane Harris,Customer Support Lead,6,"Zendesk, Salesforce, Team Leadership, De-escalation, KPIs","Managing the Tier 2 customer support team and tracking performance KPIs.","Zane leads the customer support team, handling escalated issues and training new agents. He is an expert in Zendesk and uses data to track and improve support metrics."